RecipeId,Name,AuthorId,AuthorName,CookTime,PrepTime,TotalTime,DatePublished,Description,Images,RecipeCategory,Keywords,RecipeIngredientQuantities,RecipeIngredientParts,AggregatedRating,ReviewCount,Calories,FatContent,SaturatedFatContent,CholesterolContent,SodiumContent,CarbohydrateContent,FiberContent,SugarContent,ProteinContent,RecipeServings,RecipeYield,RecipeInstructions
172,Chicken Pot Pie Lasagna,1562,Libby1,PT1H35M,PT35M,PT2H10M,1999-09-20T19:45:00Z,Make and share this Chicken Pot Pie Lasagna recipe from Food.com.,character(0),Savory Pies,"c(""One Dish Meal"", ""Chicken Breast"", ""Chicken"", ""Poultry"", ""Meat"", ""European"", ""Weeknight"", ""Oven"", ""< 4 Hours"")","c(NA, ""1"", ""3"", ""1"", ""1/2"", ""1"", ""1"", ""1/2"", ""1/2"", ""3 1/2"", ""1/2"", ""1/4"", ""1"", ""1 1/2"", ""1/2"")","c(""boneless chicken breast"", ""fresh mushrooms"", ""carrot"", ""spring onion"", ""frozen green pea"", ""thyme"", ""salt"", ""all-purpose flour"", ""skim milk"", ""dry sherry"", ""low-fat ricotta cheese"", ""part-skim mozzarella cheese"", ""lowfat swiss cheese"")",5.0,8.0,334.8,13.8,7.2,68.1,517.3,19.2,2.1,3.2,30.8,10.0,,"c(""Prepare pasta according to package directions."", ""Spray a Dutch oven or large   skillet with cooking spray; place over medium-high heat until hot. Add  chicken  and saute 4 minutes or until cooked through."", ""Drain well and set  aside.   Recoat Dutch oven with cooking spray and place over medium-high heat until   hot. Add  mushrooms, carrots and onions; saute 6 minutes."", ""Set aside.  Place flour in a  medium saucepan."", ""Gradually add milk, stirring with a wire   whisk until blended; stir in sherry."", 
""Bring to a boil over medium heat and  cook for 5 minutes or  until thickened, stirring constantly."", ""Stir in salt  and  red pepper."", ""Reserve one cup of sauce and set aside.  In a bowl, combine ricotta cheese, 1 cup mozzarella cheese and Swiss  cheese.  Preheat oven to 350 degrees."", ""Spread 1 cup of the  sauce over the bottom of  a  13 x9 x 2-inch pan."", ""Arrange 4 pieces of the lasagne (3 lengthwise, 1  widthwise)over the sauce. Top with half of ricotta cheese  mixture, half of   chicken mixture and half of remaining sauce mixture.   Repeat layers, ending with 4 pieces of lasagne. Spread reserved 1 cup of  sauce over  the last complete layer of lasagne, being sure to cover the  lasagne completely."", 
""Cover lasagne with foil and bake 1 hour."", ""Uncover  lasagne,  sprinkle remaining  1/2 cup mozzarella cheese on top and bake an additional  5  minutes uncovered."", ""Re-cover and let stand 15 minutes before serving."")"
1119,Spaghetti Pie,1530,Carole Reu,PT20M,PT5M,PT25M,1999-08-18T04:58:00Z,Make and share this Spaghetti Pie recipe from Food.com.,"c(""https://img.sndimg.com/food/image/upload/w_555,h_416,c_fit,fl_progressive,q_95/v1/img/recipes/11/19/pic0x6SpS.jpg"", ""https://img.sndimg.com/food/image/upload/w_555,h_416,c_fit,fl_progressive,q_95/v1/img/recipes/11/19/picDSGoCF.jpg"")",One Dish Meal,"c(""Spaghetti"", ""European"", ""< 30 Mins"", ""Oven"")","c(""4"", ""1"", ""1/4"", ""8"", ""1/2"", ""1/2"", ""1/2"", ""1"", ""8"", ""1"", ""1"", ""1/2"")","c(""spaghetti"", ""egg"", ""nonfat parmesan cheese"", ""extra lean beef"", ""onion"", ""green pepper"", ""fennel seed"", ""garlic"", ""tomato sauce"", ""oregano"", ""low fat cottage cheese"", ""lowfat mozzarella cheese"")",5.0,23.0,192.8,4.3,1.7,60.6,390.0,20.6,1.7,3.0,17.4,6.0,,"c(""Cook spaghetti for 10 to 12 minutes or until tender but still firm."", ""Drain well."", ""Return spaghetti to saucepan."", ""Stir in egg and Parmesan cheese.  In a medium  skillet, cook ground beef, onion, green pepper, garlic and fennel till meat is  browned and onion is tender."", ""Drain fat.  Stir in tomato sauce and oregano; heat through."", ""Spray a 9\"" pie plate with nonstick cooking spray."", ""Press spaghetti  mixture onto bottom and up sides of pie plate, forming a crust.  Spread cottage  cheese on bottom and up sides of crust.  Spread meat mixture over cottage  cheese.  Sprinkle with mozzarella cheese.    Bake 350 for 20 to 25 minutes or  till bubbly.""
)"
2729,Hono Bread - Honokakor,1549,Dave5003,,PT0S,PT0S,1999-09-01T12:13:00Z,There are many variations of this bread which is often baked on the islands off the West Coast of Sweden.,character(0),Yeast Breads,"c(""Breads"", ""Swedish"", ""Scandinavian"", ""European"", ""Healthy"", ""< 15 Mins"", ""For Large Groups"", ""Oven"")","c(""2"", ""1/2"", ""1"", ""1/4"", ""3"", ""3"", ""3"", ""2"", ""8"")","c(""active compressed yeast"", ""butter"", ""margarine"", ""milk"", ""light corn syrup"", ""salt"", ""anise seed"", ""fennel"", ""all-purpose flour"")",,,127.4,3.0,1.7,7.9,174.2,21.7,1.2,0.6,3.4,,8-10 bread rounds,"c(""Crumble the yeast in a mixing bowl."", ""In saucepan, melt the butter and then add the milk."", ""Heat to 99M-0F/37M-0C or lukewarm."", ""Dissolve the yeast in a little of the warm milk."", ""Add the rest of the liquid, syrup, salt, aniseed, fennel, and rye flour to the yeast. Stir together and add the all-purpose flour."", ""Work the dough until smooth and shiny."", ""Cover and let rise for 20 - 30 minutes."", ""Turn the dough out onto a floured surface and knead well."", ""Divide into 8 - 10 sections and roll each section into a smooth ball."", 
""Cover and let rise under a baking cloth in a warm room for 25 - 30 minutes."", ""Then, with a rolling pin, roll out large rounds of bread, about 10\"" (27 cm) in diameter."", ""Place bread on greased baking sheet and allow to rise for 5 minutes."", ""Prick surface with a fork."", ""Bake in the center of the oven for about 5 minutes."", ""Cover and let cool."")"
3116,Chicken Biryani,148316,- Carla -,PT1H15M,PT15M,PT1H30M,1999-10-05T00:16:00Z,"Biryani is a combination of rice with meat, chicken, shrimp, vegetables or fish. It is a meal within itself. Don't be put off by the long list of ingredients, it is really an easy dish to prepare and tasty too.",character(0),One Dish Meal,"c(""Chicken"", ""Poultry"", ""Rice"", ""Meat"", ""Asian"", ""Indian"", ""< 4 Hours"")","c(""1 1/2"", ""1/2"", ""5"", ""2 -3"", ""1"", ""3"", ""3"", ""4"", ""1/4"", ""5"", ""1/4"", ""1"", ""1"", ""1/2"", ""3"", ""1"", ""1"", ""4"", ""2"", ""2/3"", ""1/2"", ""2/3"", ""3"", NA, NA)","c(""basmati rice"", ""salt"", ""whole cardamom pods"", ""whole cloves"", ""cinnamon stick"", ""onions"", ""chicken breasts"", ""ground cloves"", ""cardamom pods"", ""chile"", ""ground cumin"", ""ground coriander"", ""fresh ground black pepper"", ""garlic cloves"", ""fresh ginger"", ""tomatoes"", ""fresh cilantro"", ""plain yogurt"", ""saffron thread"", ""water"", ""fresh cilantro stem"", ""plain yogurt"")",4.0,2.0,763.3,32.6,7.5,114.2,437.1,72.2,6.8,9.8,45.9,4.0,,"c(""Preheat the oven to 375°F."", ""Bring a pan of water to a boil and add the rice, salt, cardamom pods, cloves and cinnamon stick; boil for two minutes and then drain, leaving the whole spices in the rice."", ""Heat the oil in a pan and fry the onions for about 8 minutes, until browned."", ""Add the chicken, followed by the ground cloves, cardamom, chilies, cumin, coriander, black pepper, garlic, ginger and lemon juice; stir-fry 5 minutes."", ""Transfer the chicken mixture to a casserole and lay the sliced tomatoes on top."", 
""Sprinkle on the cilantro, spoon on the plain yogurt and top with drained basmati rice."", ""Drizzle the saffron and milk over the rice and pour on 2/3 cup water."", ""Cover tightly and bake in the oven for 1 hour."", ""Transfer to a warmed serving platter and remove the whole spices from the rice."", ""Garnish with toasted almonds and freshly chopped cilantro and serve with plain yogurt."")"
3858,Shepherd's Pie With Eggplant (Aubergine),1549,Dave5003,PT40M,PT30M,PT1H10M,1999-11-02T05:06:00Z,Make and share this Shepherd's Pie With Eggplant (Aubergine) recipe from Food.com.,character(0),One Dish Meal,"c(""Vegetable"", ""Low Cholesterol"", ""Healthy"", ""Weeknight"", ""Oven"", ""< 4 Hours"")","c(""2"", ""1"", NA, ""1/2"", ""1/2"", ""1/2"", ""1 1/2"", NA, ""1"", ""1"", NA, ""1"", ""12"", ""1"", ""1"", ""1/4"", ""1/2"", ""1/2"", ""1"", ""1/2"", ""3"", ""1"")","c(""potatoes"", ""butter"", ""yogurt"", ""chives"", ""parsley"", ""butter"", ""onion"", ""garlic clove"", ""salt"", ""black pepper"", ""celery"", ""mushrooms"", ""eggplant"", ""green bell pepper"", ""thyme"", ""basil"", ""oregano"", ""peas"", ""cheddar cheese"", ""wheat germ"", ""cider vinegar"")",5.0,5.0,262.8,9.6,5.6,25.3,511.6,36.6,8.5,7.0,10.9,6.0,,"c(""Preheat oven to 350°F."", ""Cook the potatoes (in their skins) in boiling water, until soft.  Drain, and mash the first 5 ingredients. Set aside."", ""In a large, heavy skillet, saute the onions and garlic in 1 1/2 Tbsp of butter, with salt and pepper, until the onions are soft (5-8 minutes). Add the celery, mushrooms, and eggplant.  Cook over low heat, stirring occasionally."", ""When the eggplant is cooked through (and this will happen more quickly if you cover the skillet between stirrings), add green pepper, herbs, and peas.  Continue cooking about 5 minutes longer."", 
""Remove from heat; toss with cheese, wheat germ, and vinegar.  Spread this mixture into your buttered deep-dish casserole.  Spread the mashed potatoes on top, as a crust."", ""OPTIONAL (and OPTIMAL):  Sprinkle extra cheese plus some paprika on top."", ""Bake, uncovered, 35 minutes."")"
3893,Vegetarian Shepherd's Pie,1886,HELEN PEAGRAM,,PT0S,PT0S,1999-11-10T01:13:00Z,Make and share this Vegetarian Shepherd's Pie recipe from Food.com.,"c(""https://img.sndimg.com/food/image/upload/w_555,h_416,c_fit,fl_progressive,q_95/v1/img/recipes/38/93/picRKEgr6.jpg"", ""https://img.sndimg.com/food/image/upload/w_555,h_416,c_fit,fl_progressive,q_95/v1/img/recipes/38/93/picjhEuIP.jpg"")",One Dish Meal,"c(""< 15 Mins"", ""Oven"")","c(""1"", ""4"", ""2"", NA, ""1"", ""1"", ""8"", ""1"", ""2"", ""1"", ""1/2"", ""1"", ""1/2"", ""275"", NA, ""1"")","c(""parsley"", ""adzuki beans"", ""brown rice"", ""water"", ""onion"", ""carrots"", ""soy sauce"", ""tomato paste"", ""garlic powder"", ""oregano"", ""basil"", ""marjoram"", ""potato"")",4.0,7.0,309.8,4.3,0.7,0.0,364.9,59.0,9.2,5.9,10.9,4.0,,"c(""Wash the beans and rice in plenty of cold water. Combine about 4 cups  of water with beans and rice and cook for 5o minutes or until the beans  are soft. Drain, reserving the stock for later."", ""Heat oil in a skillet. Fry the onions for 3 minutes."", ""Add the  carrots and cook covered for 5 minutes."", ""Add the cooked beans and rice.  Stir well and let saute for a few minutes, ensuring   that the mixture  does not burn."", ""Combine the soy sauce, tomato paste, herbs and stock."", ""Mix well and pour into the skillet. Bring to a boil, reduce heat to  very low, partially cover and simmer gently for 30 minutes, stirring  frequently to prevent it burning. Add more stock if necessary."", 
""Transfer into a casserole.  Top the cooked vegetables with mashed potatoes."", ""Bake in a preheated  oven at 350F for 40 minutes, or until the potatoes are browned."", ""Serve with vegetables or a green salad."")"
4110,Lasagna Pierogi,1534,Tonkcats,,PT0S,PT0S,1999-11-10T01:13:00Z,Make and share this Lasagna Pierogi recipe from Food.com.,character(0),One Dish Meal,"c(""European"", ""< 15 Mins"", ""Oven"")","c(""7"", ""2"", ""6 -8"", ""1"", ""1"", ""1"")","c(""potatoes"", ""onions"", ""butter"", ""margarine"", ""cheese"", ""evaporated milk"")",4.5,5.0,620.9,39.9,25.0,109.8,529.1,55.4,6.3,4.1,13.5,,,"c(""Cook lasagna and drain."", ""Chop onions and cook in butter or margarine only until  clear, but not brown. Saute on low heat."", ""Cook and mash potatoes; add cheese to  potatoes."", ""Spread 2 pieces of lasagna on bottom of 9 x 13-inch pan."", ""Spread  potatoes with cheese over top of lasagna, then spread butter and onions over  potatoes and start over with layer of lasagna, etc. End with layer of lasagna."", ""Then pour can of Pet milk over top and bake in oven at 350 degrees until milk  bubbles."", ""Cut in squares and serve with sour cream."", 
""Sprinkle paprika on top of  potatoes (optional)"")"
4599,Swedish Spritz Cookies,1534,Tonkcats,PT8M,PT0S,PT8M,1999-12-01T20:03:00Z,Make and share this Swedish Spritz Cookies recipe from Food.com.,character(0),Dessert,"c(""Cookie & Brownie"", ""Swedish"", ""Scandinavian"", ""European"", ""< 15 Mins"", ""Oven"")","c(""1"", ""1/2"", ""1"", ""1"", ""1/2"", ""2 1/2"")","c(""butter"", ""sugar"", ""egg"", ""vanilla extract"", ""all-purpose flour"")",5.0,1.0,38.6,2.3,1.4,8.3,16.5,4.0,0.1,1.2,0.5,,84 cookies,"c(""Preheat oven to 350°."", ""In large bowl, cream butter and sugar until light and fluffy."", ""Beat in egg and extracts."", ""Gradually blend in flour."", ""Fill cookie press with dough."", ""Using star attachments, form \""S\"" shapes on ungreased cookie sheets."", ""Bake cookies 8-10 minutes."")"
4643,Tjock Pan Kaka (Swedish Thick Pancake),1534,Tonkcats,PT30M,PT10M,PT40M,1999-12-01T20:03:00Z,Make and share this Tjock Pan Kaka (Swedish Thick Pancake) recipe from Food.com.,character(0),Breakfast,"c(""Swedish"", ""Scandinavian"", ""European"", ""< 60 Mins"", ""Oven"", ""Easy"")","c(""1/4"", ""1"", ""1 1/2"", ""4"", ""1 1/2"")","c(""butter"", ""salt"", ""milk"", ""eggs"", ""flour"")",4.5,5.0,268.3,13.4,7.3,152.9,171.2,26.9,0.8,0.2,9.5,6.0,,"c(""Melt butter in 9 x 13-inch pan."", ""Stir together the eggs,  salt and flour."", ""Add milk, but do not beat. Pour into pan with  the melted butter."", ""Bake at 400 degrees until browned, about 30  minutes."", ""Will puff up like popovers."", ""Cut into serving slices  and serve immediately with strawberries,  lingonberries or  syrup."")"
4902,Corn Side Dish,1642,M Messer,PT15M,PT10M,PT25M,1999-11-24T07:18:00Z,"This is not only fairly easy, but if you have all of stuff ready can be thrown together in the microwave and it's done in 12-15 minutes.  I got it when I bought my Panasonic microwave way back in the 70's.  It is very good &amp; very different.",character(0),One Dish Meal,"c(""Corn"", ""Vegetable"", ""Canadian"", ""Low Protein"", ""Low Cholesterol"", ""Healthy"", ""Microwave"", ""Roast"", ""Broil/Grill"", ""< 30 Mins"", ""Oven"", ""No Cook"", ""Small Appliance"", ""Easy"")","c(""1/3"", ""1/3"", ""2"", ""1"", ""1"", ""1"", ""1"", ""2"", ""1"", ""1"", ""1/2"", ""1"", ""1"")","c(""celery"", ""green pepper"", ""olive oil"", ""frozen corn"", ""tomato sauce"", ""mushroom stems and pieces"", ""tomatoes"", ""brown sugar"", ""onion powder"", ""garlic powder"", ""salt"", ""black pepper"", ""cayenne pepper"")",5.0,3.0,147.5,3.1,0.5,0.0,725.6,30.2,4.1,11.3,4.0,4.0,,"c(""In 2-1/2 to 3 qt casserole dish, toss celery and green pepper in oil."", ""Microwave on high for 2 minutes."", ""Add all rest of ingredients."", ""Mix thoroughly, cover and cook on medium high until done for 9-10 minutes (I think)."", ""That's a guess, you'll have to check to make sure everything is done and hot."", ""This is also good cold."", ""I use it when we have block parties or large picnics."")"
4934,Crock Pot Cabbage Rolls,1885,Linda Sorichetti,PT8H,PT0S,PT8H,1999-11-26T04:45:00Z,Make and share this Crock Pot Cabbage Rolls recipe from Food.com.,character(0),One Dish Meal,"c(""Lamb/Sheep"", ""Rice"", ""Meat"", ""Weeknight"")","c(""12"", ""1"", ""1/2"", ""1"", ""3/4"", ""1/2"", ""1/8"", ""1/4"", ""1/4"", ""1/4"")","c(""cabbage"", ""lean ground beef"", ""ground lamb"", ""rice"", ""tomato paste"", ""water"", ""salt"", ""pepper"", ""thyme"", ""nutmeg"", ""cinnamon"")",4.0,6.0,227.4,7.9,3.2,49.1,478.8,21.1,2.6,5.0,18.0,6.0,,"c(""Wash cabbage leaves."", ""Boil 4 cups water."", ""Turn off heat. Soak leaves in water for 5 minutes. Remove, drain and cool."", ""Combine ground meat; rice, salt, pepper,  thyme, nutmeg and cinnamon."", ""Place 2 tablespoons meat mixture on each leaf and roll firmly."", ""Stack in electric slow cooker."", ""Combine tomato paste and water; pour over stuffed cabbage. Cover."", ""Cook on low setting for 8-10 hours."")"
7036,Baked Stuffed Bell Peppers,148316,- Carla -,PT2H,PT15M,PT2H15M,2000-03-06T16:21:00Z,"There are so many recipes for Baked Stuffed Peppers - each a little different, each bringing something a little different to the dinner table.  This is the recipe I learned from my mother.  A meal in itself I generally serve 1 stuffed pepper &quot;half&quot; per person along with freshly baked French bread and a tossed salad, for those with healthier appetites you can of course serve 2 &quot;halves&quot; per person.  I like to use red and or yellow peppers over the green - I find the red/yellow peppers to be a bit sweeter.  These can also be made ahead and frozen for OAMC - when ready to use simply thaw overnight in the fridge and bake as directed.","c(""https://img.sndimg.com/food/image/upload/w_555,h_416,c_fit,fl_progressive,q_95/v1/img/recipes/70/36/pic67x4TT.jpg"", ""https://img.sndimg.com/food/image/upload/w_555,h_416,c_fit,fl_progressive,q_95/v1/img/recipes/70/36/picUKiiSv.jpg"", ""https://img.sndimg.com/food/image/upload/w_555,h_416,c_fit,fl_progressive,q_95/v1/img/recipes/70/36/picblAULd.jpg"", ""https://img.sndimg.com/food/image/upload/w_555,h_416,c_fit,fl_progressive,q_95/v1/img/recipes/70/36/picPemaUG.jpg"")",One Dish Meal,"c(""Rice"", ""Vegetable"", ""Meat"", ""Winter"", ""Oven"", ""Freezer"", ""< 4 Hours"")","c(""4"", ""1"", ""1"", ""1"", ""1"", ""2"", ""1"", ""1"", ""1/8"", NA, NA, NA)","c(""ground beef"", ""cooked rice"", ""pepper"", ""onion"", ""garlic cloves"", ""egg"", ""sharp cheddar cheese"")",4.5,33.0,386.7,18.9,7.2,123.7,164.7,26.2,3.3,6.4,25.9,,,"c(""Preheat your oven to 350°F."", ""In a large bowl combine ground beef, cooked rice, minced pepper, minced onion, minced garlic, Italian seasonings, beaten egg, breadcrumbs and salt and freshly ground black pepper, to taste."", ""Use your hands to mix ingredients well."", ""Using a 1/2 cup measuring cup - measure out a 1/2 cup meat mixture for each halved pepper and fill."", ""*At this point, if you are using this recipe for OAMC you can wrap your peppers in saranwrap, then place them in a zip-lock bag and store them in the freezer for later use.*."", 
""Place peppers in a baking dish and cover with your favorite jarred or homemade spaghetti sauce (about 1 cup per pepper half)."", ""Cover and allow to cook 90 minutes (Please note that I have only ever made 4 halves at one time - so the cooking time could be longer if making 6 or more at the same time.)."", ""After 90 minutes, check to see how far along the peppers are cooked; if they are nearly done uncover and baste with some of the spaghetti sauce from the baking dish (as mentioned above, if baking many peppers all at one time there is the possibility that they will not be as far along at this point - please continue to bake covered an additional 30 to 45 minutes and then proceed with the following instructions.)."", 
""Bake an additional 20 minutes then top each pepper half with shredded cheese and continue baking another 10 to 15 minutes."", ""Serve along side freshly baked bread and a salad, enjoy!"")"
7949,Tortellini Ai Formaggi With Prosciutto and Peas,148316,- Carla -,PT10M,PT5M,PT15M,2000-03-13T21:44:00Z,"Simple and delicate, Tortellini ai Formaggi with Prosciutto and Peas is a delicious and easy dish to prepare for a romantic evening meal.","c(""https://img.sndimg.com/food/image/upload/w_555,h_416,c_fit,fl_progressive,q_95/v1/img/recipes/79/49/picobciE9.jpg"", ""https://img.sndimg.com/food/image/upload/w_555,h_416,c_fit,fl_progressive,q_95/v1/img/recipes/79/49/zA3jXJ65SxiunxKRIw50-tort.JPG"", ""https://img.sndimg.com/food/image/upload/w_555,h_416,c_fit,fl_progressive,q_95/v1/img/recipes/79/49/01483922201.jpeg"", ""https://img.sndimg.com/food/image/upload/w_555,h_416,c_fit,fl_progressive,q_95/v1/img/recipes/79/49/WuVFUBnrTVCywl2fUQmS-2013-12-10-17.08.28.jpg"", 
""https://img.sndimg.com/food/image/upload/w_555,h_416,c_fit,fl_progressive,q_95/v1/img/recipes/79/49/piczIVIMv.jpg"", ""https://img.sndimg.com/food/image/upload/w_555,h_416,c_fit,fl_progressive,q_95/v1/img/recipes/79/49/pic1JOt45.jpg"")",One Dish Meal,"c(""Ham"", ""Pork"", ""Meat"", ""European"", ""Winter"", ""Savory"", ""< 15 Mins"", ""Beginner Cook"", ""Easy"")","c(""12"", ""1/4"", ""2"", ""2"", ""1/4"", ""1"", ""1"", ""1/4"", ""3/4"", NA)","c(""water"", ""butter"", ""garlic cloves"", ""prosciutto"", ""heavy cream"", ""nutmeg"", ""parmesan cheese"", ""frozen baby peas"")",5.0,51.0,1137.3,71.7,43.0,276.0,1389.8,92.7,6.1,5.0,33.5,2.0,,"c(""Cook tortellini according to package directions."", ""Melt butter in skillet and cook garlic for 1 minute."", ""Add Prosciutto and cook for 2 minutes."", ""Add heavy cream and bring to a simmer."", ""Add nutmeg and simmer until cream is thickened and reduced by half."", ""Stir in 1/4 cup Parmesan and peas."", ""Stir in reserved cooking liquid and tortellini and toss to coat."", ""Season to taste with salt and freshly ground black pepper."", ""Serve and enjoy!"")"
8079,Mexican Fiesta Casserole,148316,- Carla -,PT35M,PT15M,PT50M,2000-03-13T21:47:00Z,"I adopted this recipe in February 2005.  While I'm not much of a casserole person, this one looks to be pretty good.","""https://img.sndimg.com/food/image/upload/w_555,h_416,c_fit,fl_progressive,q_95/v1/img/recipes/80/79/picfqnRNx.jpg""",One Dish Meal,"c(""Vegetable"", ""Meat"", ""Mexican"", ""< 60 Mins"", ""Oven"")","c(""1"", NA, ""1"", ""1"", ""1"", ""2/3"", ""1/4"", ""2"", ""1/2"", ""2"", ""1/2"", ""1"")","c(""lean ground beef"", ""chili powder"", ""cheddar cheese"", ""sour cream"", ""mayonnaise"", ""onion"", ""Bisquick baking mix"", ""water"", ""tomatoes"", ""green bell pepper"", ""black olives"")",4.0,5.0,511.1,31.1,13.6,89.7,848.3,33.0,2.7,8.0,24.8,6.0,,"c(""Preheat the oven to 375F."", ""Cook the ground beef in a large skillet until browned; drain off the excess fat."", ""Season the meat with the salt and pepper; set aside."", ""Mix together the cheese, sour cream, mayonnaise and onion; set this mixture aside."", ""Stir the biscuit mix and water together until a soft dough forms."", ""With floured fingers, pat the dough into the bottom of a greased 13 X 9 X 2-inch baking pan, pressing the dough about 1/2-inch up the sides of the pan."", ""Layer the browned ground beef, tomato slices, green pepper, and sliced olives over the dough layer."", 
""Spoon the sour cream and cheese mixture over the top."", ""Bake, uncovered, until the edges of the dough are light brown, 25 to 30 minutes."", ""Cool 5 minutes and then cut into squares to serve."")"
8124,Swedish Cheese Pie,125579,GrandmaIsCooking,PT45M,PT15M,PT1H,2000-03-13T21:48:00Z,Make and share this Swedish Cheese Pie recipe from Food.com.,character(0),Pie,"c(""Dessert"", ""Cheese"", ""Swedish"", ""Scandinavian"", ""European"", ""< 60 Mins"", ""Oven"")","c(""1"", ""2"", ""3"", ""1/4"", ""1/4"", ""1"", ""1/2"")","c(""cottage cheese"", ""eggs"", ""unbleached flour"", ""sugar"")",,,343.8,22.1,7.9,107.0,367.9,23.8,1.9,7.0,13.4,8.0,,"c(""Preheat the oven to 350 degrees F."", ""Press the cottage cheese through a sieve.  Place in a large mixing bowl and beat until smooth."", ""Add the eggs, flour, sugar, cream, and finely chopped almond and blend well."", ""Pour the mixture into the prepared crust and bake for about 45 minutes or until a knife comes out clean."", ""Remove the pie from the oven, then cool before serving."")"
8341,Stir-fried Chicken in Black Bean Sauce,148316,- Carla -,PT15M,PT30M,PT45M,2000-03-16T20:09:00Z,Make and share this Stir-fried Chicken in Black Bean Sauce recipe from Food.com.,character(0),One Dish Meal,"c(""Chicken"", ""Poultry"", ""Black Beans"", ""Beans"", ""Vegetable"", ""Meat"", ""Asian"", ""Savory"", ""< 60 Mins"", ""Stir Fry"")","c(""1"", ""1"", ""1 1/2"", ""1/2"", ""1"", ""1"", ""2"", ""2"", ""1"", ""2"", ""2"", ""4"", ""2"", ""5"")","c(""boneless chicken breast"", ""light soy sauce"", ""dry sherry"", ""salt"", ""sugar"", ""cornflour"", ""fresh ginger"", ""garlic"", ""shallots"", ""spring onions"", ""black beans"")",4.0,1.0,296.9,18.5,4.1,72.6,616.0,5.7,0.8,1.4,25.1,4.0,,"c(""Place the chicken in a bowl and mix with the soy sauce, sherry, salt, sugar, sesame oil and cornflour."", ""Heat a wok over a high heat and add the oil. When it is very hot (slightly smoking), add the chicken and stir-fry 2 minutes."", ""Add the ginger, garlic, shallots, 1 & 1/2 tbsp of the spring onions and the black beans; stir-fry additional 2 minutes."", ""Add the stock and bring mixture to a boil."", ""Reduce heat, cover and simmer 3 minutes or until chicken is cooked."", ""Garnish with the remaining spring onions and serve.""
)"
